{
  "version": "1.0.0",
  "schema_version": "1.0.0",
  "metadata": {
    "generated_at": "2026-09-22T15:18:53.173147+00:00",
    "total_capabilities": 170,
    "accounting": {
      "unique_defined_ids": 170,
      "active_executable_assertions": 170,
      "deferred_capabilities": 0,
      "quarantined_capabilities": 0,
      "disabled_capabilities": 0,
      "wrapped_assertions": 37
    }
  },
  "capabilities": [
    {
      "id": "MDS-REF-001",
      "name": "Core files existence",
      "description": "Verifies all required reference application files exist",
      "layer": "A_REPOSITORY",
      "category": "STATIC",
      "execution": "PYTHON_UNIT",
      "severity": "BLOCKER",
      "status": "ACTIVE",
      "owner": "MDS Application Engineering",
      "runner": {
        "file": "MDS/Reference-Application/tests/test_reference_app.py",
        "entrypoint": "test_01_core_files_exist",
        "type": "standalone_test"
      },
      "artifacts": [],
      "depends_on": [],
      "wraps": [],
      "deferred_reason": null,
      "quarantine_reason": null,
      "disabled_reason": null
    },
    {
      "id": "MDS-REF-002",
      "name": "Zero NPM dependencies",
      "description": "Verifies zero npm package.json or node_modules dependencies",
      "layer": "A_REPOSITORY",
      "category": "STATIC",
      "execution": "PYTHON_UNIT",
      "severity": "BLOCKER",
      "status": "ACTIVE",
      "owner": "MDS Application Engineering",
      "runner": {
        "file": "MDS/Reference-Application/tests/test_reference_app.py",
        "entrypoint": "test_02_zero_npm_dependencies",
        "type": "standalone_test"
      },
      "artifacts": [],
      "depends_on": [],
      "wraps": [],
      "deferred_reason": null,
      "quarantine_reason": null,
      "disabled_reason": null
    },
    {
      "id": "MDS-REF-003",
      "name": "Imports MDS core CSS",
      "description": "Verifies application consumes styles.css from Runtime",
      "layer": "C_CSS",
      "category": "INTEGRATION",
      "execution": "PYTHON_UNIT",
      "severity": "MAJOR",
      "status": "ACTIVE",
      "owner": "MDS Application Engineering",
      "runner": {
        "file": "MDS/Reference-Application/tests/test_reference_app.py",
        "entrypoint": "test_03_imports_mds_core_css",
        "type": "standalone_test"
      },
      "artifacts": [],
      "depends_on": [],
      "wraps": [],
      "deferred_reason": null,
      "quarantine_reason": null,
      "disabled_reason": null
    },
    {
      "id": "MDS-REF-004",
      "name": "Imports components JS",
      "description": "Verifies application consumes components.js from Runtime",
      "layer": "D_COMPONENTS",
      "category": "INTEGRATION",
      "execution": "PYTHON_UNIT",
      "severity": "MAJOR",
      "status": "ACTIVE",
      "owner": "MDS Application Engineering",
      "runner": {
        "file": "MDS/Reference-Application/tests/test_reference_app.py",
        "entrypoint": "test_04_imports_components_js",
        "type": "standalone_test"
      },
      "artifacts": [],
      "depends_on": [],
      "wraps": [],
      "deferred_reason": null,
      "quarantine_reason": null,
      "disabled_reason": null
    },
    {
      "id": "MDS-REF-005",
      "name": "CSS layer overrides",
      "description": "Verifies application CSS is enclosed in @layer mds.overrides",
      "layer": "C_CSS",
      "category": "INTEGRATION",
      "execution": "PYTHON_UNIT",
      "severity": "MAJOR",
      "status": "ACTIVE",
      "owner": "MDS Application Engineering",
      "runner": {
        "file": "MDS/Reference-Application/tests/test_reference_app.py",
        "entrypoint": "test_05_css_in_layer_overrides",
        "type": "standalone_test"
      },
      "artifacts": [],
      "depends_on": [],
      "wraps": [],
      "deferred_reason": null,
      "quarantine_reason": null,
      "disabled_reason": null
    },
    {
      "id": "MDS-REF-006",
      "name": "Cairo font and RTL defaults",
      "description": "Verifies Cairo font and dir='rtl' default directionality",
      "layer": "C_CSS",
      "category": "INTEGRATION",
      "execution": "PYTHON_UNIT",
      "severity": "MAJOR",
      "status": "ACTIVE",
      "owner": "MDS Application Engineering",
      "runner": {
        "file": "MDS/Reference-Application/tests/test_reference_app.py",
        "entrypoint": "test_06_cairo_font_and_rtl_defaults",
        "type": "standalone_test"
      },
      "artifacts": [],
      "depends_on": [],
      "wraps": [],
      "deferred_reason": null,
      "quarantine_reason": null,
      "disabled_reason": null
    },
    {
      "id": "MDS-REF-007",
      "name": "All 6 templates implemented",
      "description": "Verifies all 6 canonical templates are implemented",
      "layer": "F_PATTERNS_WORKFLOWS_TEMPLATES",
      "category": "INTEGRATION",
      "execution": "PYTHON_UNIT",
      "severity": "CRITICAL",
      "status": "ACTIVE",
      "owner": "MDS Application Engineering",
      "runner": {
        "file": "MDS/Reference-Application/tests/test_reference_app.py",
        "entrypoint": "test_07_all_6_templates_implemented",
        "type": "standalone_test"
      },
      "artifacts": [],
      "depends_on": [],
      "wraps": [],
      "deferred_reason": null,
      "quarantine_reason": null,
      "disabled_reason": null
    },
    {
      "id": "MDS-REF-008",
      "name": "All 8 patterns implemented",
      "description": "Verifies all 8 canonical patterns are composed",
      "layer": "F_PATTERNS_WORKFLOWS_TEMPLATES",
      "category": "INTEGRATION",
      "execution": "PYTHON_UNIT",
      "severity": "CRITICAL",
      "status": "ACTIVE",
      "owner": "MDS Application Engineering",
      "runner": {
        "file": "MDS/Reference-Application/tests/test_reference_app.py",
        "entrypoint": "test_08_all_8_patterns_implemented",
        "type": "standalone_test"
      },
      "artifacts": [],
      "depends_on": [],
      "wraps": [],
      "deferred_reason": null,
      "quarantine_reason": null,
      "disabled_reason": null
    },
    {
      "id": "MDS-REF-009",
      "name": "All 4 mock roles exist",
      "description": "Verifies Administrator, Manager, Reviewer, and User roles exist",
      "layer": "H_REFERENCE_APPLICATION",
      "category": "INTEGRATION",
      "execution": "PYTHON_UNIT",
      "severity": "CRITICAL",
      "status": "ACTIVE",
      "owner": "MDS Application Engineering",
      "runner": {
        "file": "MDS/Reference-Application/tests/test_reference_app.py",
        "entrypoint": "test_09_all_4_mock_roles_exist",
        "type": "standalone_test"
      },
      "artifacts": [],
      "depends_on": [],
      "wraps": [],
      "deferred_reason": null,
      "quarantine_reason": null,
      "disabled_reason": null
    },
    {
      "id": "MDS-REF-010",
      "name": "AI human-in-loop FSM",
      "description": "Verifies 5-state operational projection (IDLE->PROCESSING->STREAMING->REVIEWING->SUCCESS_RESOLVED)",
      "layer": "H_REFERENCE_APPLICATION",
      "category": "INTEGRATION",
      "execution": "PYTHON_UNIT",
      "severity": "CRITICAL",
      "status": "ACTIVE",
      "owner": "MDS Application Engineering",
      "runner": {
        "file": "MDS/Reference-Application/tests/test_reference_app.py",
        "entrypoint": "test_10_ai_human_in_the_loop_states",
        "type": "standalone_test"
      },
      "artifacts": [],
      "depends_on": [],
      "wraps": [],
      "deferred_reason": null,
      "quarantine_reason": null,
      "disabled_reason": null
    },
    {
      "id": "MDS-REF-011",
      "name": "Zero physical directional properties",
      "description": "Verifies 100% CSS logical properties in app.css",
      "layer": "C_CSS",
      "category": "INTEGRATION",
      "execution": "PYTHON_UNIT",
      "severity": "MAJOR",
      "status": "ACTIVE",
      "owner": "MDS Application Engineering",
      "runner": {
        "file": "MDS/Reference-Application/tests/test_reference_app.py",
        "entrypoint": "test_11_zero_physical_directional_properties",
        "type": "standalone_test"
      },
      "artifacts": [],
      "depends_on": [],
      "wraps": [],
      "deferred_reason": null,
      "quarantine_reason": null,
      "disabled_reason": null
    },
    {
      "id": "MDS-REF-012",
      "name": "Zero row-reverse",
      "description": "Verifies zero row-reverse flex properties in app.css",
      "layer": "C_CSS",
      "category": "INTEGRATION",
      "execution": "PYTHON_UNIT",
      "severity": "MAJOR",
      "status": "ACTIVE",
      "owner": "MDS Application Engineering",
      "runner": {
        "file": "MDS/Reference-Application/tests/test_reference_app.py",
        "entrypoint": "test_12_zero_row_reverse",
        "type": "standalone_test"
      },
      "artifacts": [],
      "depends_on": [],
      "wraps": [],
      "deferred_reason": null,
      "quarantine_reason": null,
      "disabled_reason": null
    },
    {
      "id": "MDS-REF-013",
      "name": "Zero hardcoded hex colors",
      "description": "Verifies 0 raw hex colors in app.css",
      "layer": "C_CSS",
      "category": "INTEGRATION",
      "execution": "PYTHON_UNIT",
      "severity": "MAJOR",
      "status": "ACTIVE",
      "owner": "MDS Application Engineering",
      "runner": {
        "file": "MDS/Reference-Application/tests/test_reference_app.py",
        "entrypoint": "test_13_zero_hardcoded_hex_colors",
        "type": "standalone_test"
      },
      "artifacts": [],
      "depends_on": [],
      "wraps": [],
      "deferred_reason": null,
      "quarantine_reason": null,
      "disabled_reason": null
    },
    {
      "id": "MDS-REF-014",
      "name": "Dense spatial density deferred",
      "description": "Verifies dense 28px density is properly marked deferred to v1.1",
      "layer": "H_REFERENCE_APPLICATION",
      "category": "INTEGRATION",
      "execution": "PYTHON_UNIT",
      "severity": "MINOR",